{"$schema":"https://json-schema.org/draft/2020-12/schema","properties":{"history":{"items":{"type":"object"},"type":"array"},"openCritiques":{"items":{"type":"string"},"type":"array"},"slug":{"type":"string"},"state":{"enum":["brief","treatment","script","script-critiqued","look-and-characters","shot-list","shot-list-critiqued","generating","clips-critiqued","audio","assembled","checked-in","verified","shipped"]},"waivers":{"items":{"type":"object"},"type":"array"}},"required":["slug","state"],"title":"Project execution state","type":"object"}