{
  "slug": "desert-beggars-vampires",
  "state": "shot-list",
  "history": [
    {
      "event": "project authored 2026-10-29: brief, treatment, script, look bible, characters, 3 sequences, 9 shots, storyboard, prompts, EDL, evaluation 9.4/10"
    }
  ],
  "openCritiques": [
    "trailer tension ending (see critiques/trailer-tension-note.md)"
  ]
}